Use Case,Industry,Commercial Name,Chemical Name,Chemical Formula,Hardness (Shore A),Tensile Strength (MPa),Elongation (%),Temperature Range (°C),Property Overlap,References
Hoses for Chemical Transfer,Industrial,Aflas,Tetrafluoroethylene Propylene Rubber (FEPM),(C2F4 C3H6)n,70-90,10-20,150-300,-20 to 200,Excellent chemical resistance; thermal stability; low permeability,https://en.wikipedia.org/wiki/Fluoroelastomer
Seals for Jet Engines,Aerospace,Kalrez,Perfluoroelastomer (FFKM),(C2F4)n,75-95,20-40,100-300,-20 to 327,Extreme chemical resistance; high-temperature stability; low gas permeability,https://en.wikipedia.org/wiki/Perfluoroelastomer
Seals for Surgical Equipment,Medical,Silicone,Silicone Rubber,(C2H6OSi)n,30-90,5-10,100-700,-60 to 232,Biocompatibility; sterilization resistance; flexibility,https://en.wikipedia.org/wiki/Silicone_rubber
Seals for High-Pressure Valves,Oil & Gas,HNBR,Hydrogenated Nitrile Butadiene Rubber,(C3H3N C4H6)n,70-90,20-31,150-300,-40 to 165,High oil resistance; thermal stability; good mechanical properties,https://en.wikipedia.org/wiki/Nitrile_rubber
Seals for Nuclear Reactor Doors,Nuclear,Butyl,Isobutylene Isoprene Rubber (IIR),(C4H6 C5H8)n,40-70,7-10,500-700,-55 to 110,Radiation resistance; low permeability; durability,https://en.wikipedia.org/wiki/Butyl_rubber
Seals for Transmission Systems,Automotive,FKM,Fluoroelastomer,(C2H2F2)n,60-90,10-20,150-300,-26 to 205,Heat resistance; oil resistance; low compression set,https://en.wikipedia.org/wiki/Fluoroelastomer
Seals for Submarine Hatch Gaskets,Marine,EPDM,Ethylene Propylene Diene Monomer,(C2H4 C3H6 C6H8)n,30-90,10-20,300-600,-50 to 150,Water resistance; ozone resistance; excellent durability,https://en.wikipedia.org/wiki/EPDM_rubber
Seals for Military Tanks,Defense,Neoprene,Chloroprene Rubber (CR),(C4H5Cl)n,25-90,10-20,300-600,-40 to 107,Abrasion resistance; chemical resistance; mechanical stability,https://en.wikipedia.org/wiki/Neoprene
Seals for Acid Tanks,Chemical Processing,Aflas,Tetrafluoroethylene Propylene Rubber (FEPM),(C2F4 C3H6)n,70-90,10-20,150-300,-20 to 200,Excellent chemical resistance; high-temperature stability; durability,https://en.wikipedia.org/wiki/Fluoroelastomer
Seals for Brewery Equipment,Food & Beverage,NBR,Nitrile Butadiene Rubber,(C3H3N C4H6)n,40-90,10-20,300-600,-40 to 120,Food-grade safety; oil resistance; flexibility,https://en.wikipedia.org/wiki/Nitrile_rubber
Seals for Expansion Joints,Construction,PTFE,Polytetrafluoroethylene,(C2F4)n,50-65,20-40,100-300,-200 to 260,Weather resistance; low friction; chemical inertness,https://en.wikipedia.org/wiki/Polytetrafluoroethylene